{
  "receipt_schema_version": "1.0.0",
  "kind": "environment_promotion",
  "env_bundle_digest": "3cf70ed2719e3fd97c369c2377fc54f560282bd686d125afc73ef1485532d4d6",
  "from_status": "validation",
  "to_status": "production",
  "gate_results": [
    {
      "id": "schema_valid",
      "ok": true,
      "detail": "17 required bundle fields present"
    },
    {
      "id": "digest_recomputes",
      "ok": true,
      "detail": "env_bundle_digest recomputes"
    },
    {
      "id": "verifier_pinned",
      "ok": true,
      "detail": "verifier 1.0.0"
    },
    {
      "id": "oracle_self_consistent",
      "ok": true,
      "detail": "oracle passes 18/18 tasks"
    },
    {
      "id": "exploit_suite_green",
      "ok": true,
      "detail": "every gold > 0 and every known exploit → 0"
    },
    {
      "id": "catastrophic_zero",
      "ok": true,
      "detail": "0 catastrophic false-accepts on the honest path"
    },
    {
      "id": "human_approved",
      "ok": true,
      "detail": "approver origin-ops"
    }
  ],
  "approver": "origin-ops",
  "capability": "env.promote",
  "rollback_target": null,
  "frozen": true,
  "frozen_note": "digest-as-identity + supersede-never-mutate; NOT write-locked storage (that is P1 OCI/ORAS).",
  "receipt_digest": "f861c0455623761cba7bdf85b530d27abf4645f2d08bd0fb548a15da6dd4e047"
}
